Timestamp,Put these libraries in the order from the most preferable to the least: [1 (most preferable)],Put these libraries in the order from the most preferable to the least: [2],Put these libraries in the order from the most preferable to the least: [3],Put these libraries in the order from the most preferable to the least: [4],Put these libraries in the order from the most preferable to the least: [5 (least preferable)],Please explain why you chose such an answer. What metrics (list 3-5) were you based on?,Select at least 2 options:,Your full name:,Your working position or company:,Your working experience:,How many bugs have you reported for the last year?,"Where to send the results of our research? (Your Telegram, Mail etc.)"
11/19/2023 19:29:36,SWXMLHash,Fuzi,libexpat,xgen,quick-xml,"Considering that functionality is the same for all of them, and that my project doesn't depend on language of lib, I would choose the freshest library with the lowest amount of code (because it directly affects maintainability of lib), and then take a look at amount of stars.",Better explain how to reproduce it,,Tech Lead of Frontend Dev,4+ years,~10,
11/19/2023 20:15:29,SWXMLHash,libexpat,Fuzi,quick-xml,xgen,"Первое на что стоит смотреть это колличество звезд. Показывает насколько интересна библиотека другим разработчикам. Так же колличество закрытых багов. А вот колличество строк не всегда хороший вариант, так как сложность поддержки. И при смене логики может быть проблемой.","Прочитать руководство пользователя, возможно, что-то делаете не так, Лучше объяснить, как баг воспроизвести, Укажите его приоритет и степень серьезности",,iOS разработчик X5 Group,Более 5 лет,10-25,
11/19/2023 20:20:21,libexpat,SWXMLHash,xgen,Fuzi,quick-xml,"На количестве закрытых багов, дате последнего релиза и количестве контрибуторов. Чем больше исправленных багов и чем меньше дней назад состоялся релиз - тем лучше качество. Отсутствие исправленных багов говорит о том, что на качество библиотеки положен болт. Софта без ошибок не бывает.","Избавиться от лишнего 3-минутного видеоролика, Лучше объяснить, как баг воспроизвести",,МТС,,,
11/19/2023 21:44:55,xgen,Fuzi,libexpat,quick-xml,SWXMLHash,"Количество звёзд, форумов, контрибуторов - активность комьюнити
Количество строк кода - тяжесть библиотеки","Укажите его приоритет и степень серьезности, Лучше объяснить, как баг воспроизвести",,,,,
11/19/2023 22:09:20,SWXMLHash,Fuzi,quick-xml,xgen,libexpat,"Слишком мало инфы для выбора. Я в таких случаях заглядываю в код и выбираю более понятную библиотеку. В случае проблем чтобы можно было самим фиксить баги.

В данной таблице выбор пал на более новые библиотеки с не слишком большой кодовой базой. Вероятно не спроста делали еще одну библиотеку. Количество звездочек влияет, но не в первую очередь. Смотрю чисто для понимания сколько людей этим пользуются. Ну и форки тоже хороший показатель. Чем их больше, тем чаще пользуются библиотекой","Better explain how to reproduce it, Read user manual, maybe you do something wrong",,iOS dev,13,-,
11/20/2023 2:57:10,quick-xml,libexpat,SWXMLHash,Fuzi,xgen,"Last commit date, lines of code, primary programming language and stars.","Read user manual, maybe you do something wrong, Better explain how to reproduce it, Get rid of the redundant 3--minute video",,,,,
11/20/2023 13:28:47,libexpat,quick-xml,SWXMLHash,xgen,Fuzi,"Основные параметры - количество котрибутеров, дата последнего комита, количество звезд,  ","Избавиться от лишнего 3-минутного видеоролика, Укажите его приоритет и степень серьезности",,Mobile Head ,> 10 лет,,
11/20/2023 14:14:33,libexpat,quick-xml,SWXMLHash,Fuzi,xgen,"libexpat has many contributors and closed bug reports, it's also written in many lines of C and is quite popular, all such metrics indicate an efficient l, well-written , popular and maintained library.","Better explain how to reproduce it, Read user manual, maybe you do something wrong, Specify its priority and severity, Get rid of the redundant 3--minute video",,DevOps Engineer,~1 year,,
11/20/2023 15:17:10,libexpat,quick-xml,SWXMLHash,Fuzi,xgen,"Так как мы ищем более качественный продукт, для нас важно, чтобы его поддерживала команда разработчиков. Последние две либы имеют много контрибьюторов, а разработка продолжается, судя по последним коммитам. При этом проекты активно форкают, что вероятно понадобится и нам. 
Важен так же день релиза, более молодой проект вероятно будет проще поддерживать, если мы хотим вести работу над форком. xgen и Fuzi смущают малым количеством баг репортов","Укажите его приоритет и степень серьезности, Прочитать руководство пользователя, возможно, что-то делаете не так, Лучше объяснить, как баг воспроизвести",,Разработчик в Яндексе ,"1,5 года",Где-то до 100 - это часть моей работы),
11/20/2023 16:22:06,libexpat,quick-xml,SWXMLHash,Fuzi,xgen,"Популярность, кол-во контрибуторов и форков, свежесть коммитов и язык","Укажите его приоритет и степень серьезности, Лучше объяснить, как баг воспроизвести, Прочитать руководство пользователя, возможно, что-то делаете не так",,Руководитель службы,Более 10 лет,,
11/20/2023 23:09:53,quick-xml,SWXMLHash,xgen,Fuzi,libexpat,Release date and last commit is primary metrics (old project which still have regular updates looks good). Secondary: how hard is it to read source code (language and lines of code). Anyway main metric is out of scope: how many projects use library.,"Specify its priority and severity, Better explain how to reproduce it",,Software Developer,,,
11/24/2023 13:45:48,libexpat,quick-xml,xgen,SWXMLHash,Fuzi,"Язык программирования (как будет на андроиде свифт работать?), Last commit, Contributors, Number of closed PRs","Избавиться от лишнего 3-минутного видеоролика, Укажите его приоритет и степень серьезности, Вместо этого отправить сообщение в чат проекта, чтобы быстрее решить проблему",,Яндекс.Технологии,0,2,
11/28/2023 14:23:46,SWXMLHash,xgen,Fuzi,libexpat,quick-xml,"Stars, Programming language, Contributors","Лучше объяснить, как баг воспроизвести, Избавиться от лишнего 3-минутного видеоролика",,intern flutter developer,1 month,1,
11/29/2023 15:31:23,libexpat,xgen,quick-xml,Fuzi,SWXMLHash,"Based on amount of starts, lines of code and implementation language","Better explain how to reproduce it, Specify its priority and severity",,,,,
11/29/2023 15:31:33,libexpat,xgen,quick-xml,SWXMLHash,Fuzi,"Language performance, maintainers' support, popularity","Specify its priority and severity, Get rid of the redundant 3--minute video",,junior Inforamtion Security Specialist,2 months,around 5,
11/29/2023 15:41:49,libexpat,SWXMLHash,quick-xml,Fuzi,xgen,"Primary programming language, number of stars, last commit and number of contributors","Better explain how to reproduce it, Specify its priority and severity",,,,,
11/29/2023 15:49:39,SWXMLHash,Fuzi,libexpat,xgen,quick-xml,"Closed bug reports doesn’t mean anything because this usually depends on the programming language.
Stars is a good metric which I prefer.
Lines of code also doesn’t mean anything.
Release date - I won't choose something to old or to young.
Language depends on my purposes.
Other metrics also don't mean anything to me.
","Read user manual, maybe you do something wrong, Better explain how to reproduce it, Get rid of the redundant 3--minute video",,,,,
11/29/2023 16:12:07,quick-xml,xgen,libexpat,SWXMLHash,Fuzi,"1. There should be a familiar language
2. Amount of forks + stars
3. Last commit + release date + closed bug reports
4. Amount of contributors + closed issues","Read user manual, maybe you do something wrong, Better explain how to reproduce it, Specify its priority and severity",,,,,
11/29/2023 16:23:49,xgen,libexpat,quick-xml,SWXMLHash,Fuzi,"Programming language, release date","Read user manual, maybe you do something wrong, Better explain how to reproduce it",,,,,
11/29/2023 16:34:24,libexpat,quick-xml,SWXMLHash,Fuzi,xgen,"First of all I want FAST and WORKING solution. C and Rust languages are pretty fast and more over as I can see libexpat and quick-xml are actively developing based on last commit days. Also they have a lot of closed issue, so I conclude that developers listen to the community and fix bugs and add features. The same for bug report number. In addition they had many contributors. Indeed for me they are most preferable. Other libraries are written on exotic languages (SWIFT is language developed by APPLE for their needs not to parse XML!!!) and are not much supported by developers. ",Specify its priority and severity,,Student,unemployed,0,
11/29/2023 19:37:27,quick-xml,libexpat,xgen,SWXMLHash,Fuzi,"Наиболее важным для меня была активность репозитория (видно, что quick-xml и libexpat активно поддерживаются, последний коммит был недавно, и достаточно много закрытых баг репортов). Но quick-xml имеет преимущество над libexpat, т.к. во-первых она написана на более безопасном языке, во-вторых кодоая база libexpat очень сильно раздута. ","Избавиться от лишнего 3-минутного видеоролика, Прочитать руководство пользователя, возможно, что-то делаете не так, Лучше объяснить, как баг воспроизвести",,Embedded Developer,2 года,"В opensource 0 xD; По работе 2-5, наверное, наберется",
11/29/2023 20:11:07,libexpat,quick-xml,SWXMLHash,Fuzi,xgen,"last commit, closed issues, contributors","Get rid of the redundant 3--minute video, Instead, post to project chat, for a faster fix",,,1 year software engineer,5-10,
11/30/2023 17:30:15,SWXMLHash,Fuzi,libexpat,quick-xml,xgen,Most important metric — stars. Then release date should not be too long ago,"Specify its priority and severity, Better explain how to reproduce it, Read user manual, maybe you do something wrong",,,,,
11/30/2023 20:11:41,libexpat,SWXMLHash,xgen,Fuzi,quick-xml,"Release Date, Stars, Lines of Code","Get rid of the redundant 3--minute video, Read user manual, maybe you do something wrong, Specify its priority and severity",,,,,
11/30/2023 20:15:20,quick-xml,Fuzi,libexpat,xgen,SWXMLHash,"top 1 -> language;
top 2 -> last commit;
top 3 -> contributers","Get rid of the redundant 3--minute video, Better explain how to reproduce it",,,,,
11/30/2023 20:16:47,libexpat,quick-xml,SWXMLHash,Fuzi,xgen,I would prefer libraries to be popular among devs and always up to date,"Specify its priority and severity, Better explain how to reproduce it",,,,,
11/30/2023 21:10:27,quick-xml,SWXMLHash,libexpat,Fuzi,xgen,"Stars, release date, xloses issues","Read user manual, maybe you do something wrong, Specify its priority and severity",,,,,
11/30/2023 21:18:28,libexpat,SWXMLHash,quick-xml,Fuzi,xgen,"Stars,  last commit, prs","Specify its priority and severity, Better explain how to reproduce it, Get rid of the redundant 3--minute video",,,,,
11/30/2023 21:59:17,quick-xml,libexpat,xgen,Fuzi,SWXMLHash,"Language, Last commit date, GitHub stars","Better explain how to reproduce it, Read user manual, maybe you do something wrong",,SRE @ Tinkoff,3+ years,"maybe 5-10, at least i did 3 PRs",
11/30/2023 23:34:49,SWXMLHash,quick-xml,libexpat,Fuzi,xgen,"Number of start, programming laguage, start and closed issues / release date ","Better explain how to reproduce it, Instead, post to project chat, for a faster fix",,,,,
12/1/2023 23:43:44,quick-xml,libexpat,SWXMLHash,xgen,Fuzi,"Язык разработки, дата последнего коммита, дата релиза, количество контрибьюторов и количество закрытых багов. Сначала нужно определить требуемый язык. После мне важно, чтобы проект был активно поддерживаемым на момент его выбора.","Прочитать руководство пользователя, возможно, что-то делаете не так, Укажите его приоритет и степень серьезности, Избавиться от лишнего 3-минутного видеоролика, Вместо этого отправить сообщение в чат проекта, чтобы быстрее решить проблему, Лучше объяснить, как баг воспроизвести",,,,,
12/2/2023 20:34:49,xgen,libexpat,quick-xml,Fuzi,SWXMLHash,"Language, release date, lines of code","Specify its priority and severity, Get rid of the redundant 3--minute video, Better explain how to reproduce it",,,,,
12/2/2023 20:38:14,quick-xml,Fuzi,SWXMLHash,xgen,libexpat,"libexpat too big, 
other are placed in terms of hype: how many people have tried it(according to reports, stars and forks)","Instead, post to project chat, for a faster fix, Better explain how to reproduce it",,,,,
12/2/2023 21:33:21,SWXMLHash,xgen,Fuzi,quick-xml,libexpat,"Firstly, I chose the least preferable choice (libexpat) based on lines of code per day since release date. It is kinda suspiciously high number, so the quality of product could be questioned (in my opinion). 

The forth place is for ""quick-xml"", since Rust is created recently and such big number of days since release date is also suspicious. However, the language is promising, so the forth place.

Fuzi and xgen are both questionable because of small number of closed bug reports. It could be so due to lack discipline related to documenting bug fixes. Anyway, it seems to me that there is a better choice.

""SWXMLHash"" is the best choice among other presented because it seems that it has average metrics on all criteria. Also, all others seems suspicious to me","Specify its priority and severity, Read user manual, maybe you do something wrong",,,,,
12/2/2023 21:37:41,libexpat,SWXMLHash,Fuzi,quick-xml,xgen,"Stars / Release date (S) - Indicates approximately how many stars the library gained each day. I assume it represents the popularity and relevance of the repository. I will give this metric a weight of 2.

Closed issues / Release date (C) - Indicates how actively the project is being maintained each day, which I think is an important factor. I will give this metric a weight of 3.

Last commit (L) - Recent changes mean the library is being actively developed. I gave this metric a weight of 1.

Closed pull requests / Release date (PR) - Also indicates how actively the project is being maintained, which is an important factor. I gave this metric a weight of 2.

Final metric used: (2 * S + 3 * C + (1 / L) + 2 * PR) / 8.","Specify its priority and severity, Better explain how to reproduce it",,Leetcode,< 2 years,10,
12/2/2023 22:17:46,SWXMLHash,Fuzi,libexpat,quick-xml,xgen,"Mainly on stars, with considering closed bug reports, closed number of issues, and last commit","Get rid of the redundant 3--minute video, Better explain how to reproduce it",,Student,Small projects only,0,
12/3/2023 9:06:07,quick-xml,xgen,SWXMLHash,Fuzi,libexpat,"I went with quick-xml mainly because it's the oldest one (release date), yet it's still supported (last commit date), and because it has the most amount of contributors. This way I am more confident about the reliability of the library","Read user manual, maybe you do something wrong, Get rid of the redundant 3--minute video, Specify its priority and severity",,,,0-3,
12/3/2023 9:12:37,SWXMLHash,xgen,Fuzi,quick-xml,libexpat,-,"Specify its priority and severity, Instead, post to project chat, for a faster fix",,,,,
12/3/2023 13:58:29,quick-xml,SWXMLHash,Fuzi,libexpat,xgen,"Достаточно много звёзд
Репозиторий поддерживается, актуален
Баги закрываются, пулл реквесты принимаются
Не слишком много строк кода (652к строк явно смущают, вряд ли там все можно протестировать) ","Укажите его приоритет и степень серьезности, Вместо этого отправить сообщение в чат проекта, чтобы быстрее решить проблему",,,,,
12/4/2023 11:24:46,SWXMLHash,libexpat,quick-xml,Fuzi,xgen,"Language, stars",Specify its priority and severity,,yandex backend software developer,2 years,0,
12/4/2023 11:29:56,SWXMLHash,libexpat,quick-xml,Fuzi,xgen,"Basically, I looked for the size of community. Stars, release date, contributors.","Specify its priority and severity, Better explain how to reproduce it",,Engineering Manager,6 years,12 - 24,
12/4/2023 11:30:00,quick-xml,libexpat,SWXMLHash,Fuzi,xgen,"Last commit, Stars, Programming language","Get rid of the redundant 3--minute video, Better explain how to reproduce it, Specify its priority and severity",,Senior Software Developer,8+ years,~5-10,
12/4/2023 11:33:48,SWXMLHash,libexpat,quick-xml,Fuzi,xgen,"community activity from higher to lower: Stars, Contributors, Pull requests, issues bugs ...","Read user manual, maybe you do something wrong, Specify its priority and severity",,,5+ y.,50+,
12/4/2023 11:33:51,libexpat,quick-xml,Fuzi,SWXMLHash,xgen,"I chose more ""live"" libraries: where there are more closed issues and bugs, where there are more forks.","Better explain how to reproduce it, Specify its priority and severity",,,,,
12/4/2023 11:43:48,xgen,quick-xml,libexpat,SWXMLHash,Fuzi,"For sure, one day, something will go wrong. In this case, what library code I can fork, read and fix? So I need a familiar programming language and a small code base. Swift is the last choice for me, the first is Go, then C. But libexpat has too many lines of code, so, may be, quick-xml (Rust) is better choice for the second. ","Better explain how to reproduce it, Specify its priority and severity",,Senior Software Engineer,12,15,
12/4/2023 11:44:23,SWXMLHash,Fuzi,xgen,quick-xml,libexpat,"release date, stars, closed issues, count of contributors, lines of code","Instead, post to project chat, for a faster fix, Get rid of the redundant 3--minute video",,Senior Developer,20+ years,10+,
12/4/2023 11:53:43,SWXMLHash,libexpat,quick-xml,Fuzi,xgen,"Loc, closed issues, bug reports, last commit","Specify its priority and severity, Get rid of the redundant 3--minute video, Better explain how to reproduce it",,,,,
12/4/2023 12:02:03,quick-xml,SWXMLHash,Fuzi,xgen,libexpat,I have chosen quick-xml as most preferable because it has a lot of closed bug reports and issues. Also last commit was created 2 days ago (active repository). Besides is has 17000 lines of code which is less than 652000 libexpat (this means that quick-xml library could have many features but not so overloaded as libexpat).,"Specify its priority and severity, Get rid of the redundant 3--minute video, Better explain how to reproduce it, Read user manual, maybe you do something wrong",,Java Developer,7 years,20 - 30 bugs (as a developer).,
12/4/2023 12:40:42,quick-xml,SWXMLHash,xgen,libexpat,Fuzi,"Rust lang, greate OS track, fresh repo because last commit was 2 days ago","Get rid of the redundant 3--minute video, Better explain how to reproduce it",,Software Developer,6+ years,a few,
12/4/2023 12:41:43,SWXMLHash,libexpat,Fuzi,quick-xml,xgen,"Bugs, contributors, prs","Get rid of the redundant 3--minute video, Read user manual, maybe you do something wrong",,,,,
12/4/2023 12:53:39,quick-xml,libexpat,SWXMLHash,xgen,Fuzi,"How often is the project maintained (last commit), are contributors aware of bugs and closing those (closed bug reports), complexity (lines of code), popularity (stars and forks).","Specify its priority and severity, Better explain how to reproduce it",,,,,
12/4/2023 12:55:47,quick-xml,SWXMLHash,Fuzi,libexpat,xgen,"LOC, last commit, closed bugs, forks","Read user manual, maybe you do something wrong, Better explain how to reproduce it",,,,,
12/4/2023 13:37:29,libexpat,quick-xml,SWXMLHash,Fuzi,xgen,"Number of PRs, Closed Issues, Closed bug reports and Contributors","Read user manual, maybe you do something wrong, Specify its priority and severity, Better explain how to reproduce it",,,17 years ,5,
12/4/2023 14:46:55,quick-xml,Fuzi,SWXMLHash,xgen,libexpat,"Last commit, Stars, Release date, Lines of code","Specify its priority and severity, Get rid of the redundant 3--minute video",,Data Scientist,7,2,
12/4/2023 16:56:35,libexpat,quick-xml,SWXMLHash,Fuzi,xgen,"Closed bug reports, number of closed pull requests, forks, closed issues","Get rid of the redundant 3--minute video, Better explain how to reproduce it",,,,,
12/4/2023 21:09:08,quick-xml,SWXMLHash,Fuzi,xgen,libexpat,"Maintanability of code is based on the amount of lines of code. 

Amount of contributors with activity on code (last commit, release date, closed bugs, amount of forks) shows the popularity of repo that leads to suggestion will this repo has tendency to be abandoned soon.

Libexpat is very strange at first side and i prefer to avoid it as soon as i have something more attractive although it looks very popular.","Get rid of the redundant 3--minute video, Specify its priority and severity, Read user manual, maybe you do something wrong",,Senior backend developer,5+ years in development. 10+ in IT,3-4,
12/5/2023 9:09:54,quick-xml,Fuzi,SWXMLHash,xgen,libexpat,"feature set, safe language, but tracker and community activity","Better explain how to reproduce it, Specify its priority and severity, Get rid of the redundant 3--minute video, Read user manual, maybe you do something wrong",,,,Dozens on OSS projects,
12/6/2023 13:51:19,Fuzi,xgen,libexpat,SWXMLHash,quick-xml,stars; lines of code; programming language; last commit,"Get rid of the redundant 3--minute video, Instead, post to project chat, for a faster fix, Better explain how to reproduce it",,,,,
12/6/2023 19:14:15,quick-xml,SWXMLHash,Fuzi,xgen,libexpat,"количество контрибьютеров, закрытые баг репорты, дата релиза","Лучше объяснить, как баг воспроизвести",,Flutter-разработчик,4 года,,
12/6/2023 19:19:26,SWXMLHash,Fuzi,quick-xml,xgen,libexpat,"SWXMLHash часто используется в сообществе Swift для работы с XML данными и имеет хорошую документацию. Fuzi также является популярным выбором. quick-xml также может быть удобным, но при выборе между quick-xml и Fuzi, предпочтение может зависеть от конкретных требований проекта.

xgen и libexpat могут быть менее предпочтительными, особенно если их поддержка ограничена или если они не соответствуют требованиям проекта.","Укажите его приоритет и степень серьезности, Лучше объяснить, как баг воспроизвести",,,0,0,
