12/6/2023 19:44:43,quick-xml,libexpat,xgen,Fuzi,SWXMLHash,"Поддержка кода, низкоуровневый код (личный предпочтения), форкают чаще(можно найти нужные доработки)","Лучше объяснить, как баг воспроизвести, Вместо этого отправить сообщение в чат проекта, чтобы быстрее решить проблему, Избавиться от лишнего 3-минутного видеоролика",,Разработчик,Более 4 лет,Не считаю,
12/6/2023 20:49:52,libexpat,SWXMLHash,quick-xml,Fuzi,xgen,"Considering every library will work for the project, I aimed immediately to the second and 5th choice because they are the modern ones. I decided that libexpat would be the first choice because it still updates as we can see by commits and SWXMLHash was not updated for a long time. Other options would be lower due to having lower number of stars (libexpat was launched less an year before, so I did no count it in this criteria). Then I decided to put quick-xml because it's updating and Fuzi did not for along time. The last one is xgen because it has the smallest number of stars, was not updated recently and was published lot's of days ago.","Read user manual, maybe you do something wrong, Get rid of the redundant 3--minute video, Specify its priority and severity",,DS team-lead,"2 years of education, a half of year of being team-lead in DS team (3-7 teammates)",Did not count that:),
12/6/2023 20:54:21,quick-xml,SWXMLHash,Fuzi,libexpat,xgen,"I paid attention to closed issues, last commit date, LOC and the programming language. The number of closed issues shows that the project is actually used in the wild. If the last commit date is recent, I can hope that the project is still maintained and will receive bug fixes. LOC may vary, but if it's unreasonably low/high, it's a sign. All in all, quick-xml seems the most robust option (I can see that's used widely), then SWXMLHash (widely used, not too complex), then Fuzi, then libexpat (too many lines of code, and written in a quite unsafe language), then xgen (not sure if one can rely on it in production).","Read user manual, maybe you do something wrong, Specify its priority and severity",,,,,
12/6/2023 21:15:38,libexpat,quick-xml,xgen,SWXMLHash,Fuzi,"c(libexpat) is compatible with all languages (compatibility)
quick-xml looks like the second most popular and developed
xgen(go) is the third since it is not swift and may be run on any platform
SWXMLHash has earlier latest release","Read user manual, maybe you do something wrong, Better explain how to reproduce it",,,,,
12/6/2023 21:16:46,quick-xml,SWXMLHash,xgen,Fuzi,libexpat,"The main metric was last commit, then closed issues and bug reports. Also checked lines of code and 650k libexpat sound sus (C moment).","Specify its priority and severity, Better explain how to reproduce it",,,,,
12/6/2023 21:17:22,Fuzi,SWXMLHash,libexpat,quick-xml,xgen,"Stars, Contributors, forks, closed issues, release days","Read user manual, maybe you do something wrong, Specify its priority and severity",,,,,
12/6/2023 21:18:15,quick-xml,libexpat,xgen,SWXMLHash,Fuzi,"Language, release date, closed issues","Better explain how to reproduce it, Instead, post to project chat, for a faster fix",,,,,
12/6/2023 21:19:25,libexpat,SWXMLHash,quick-xml,Fuzi,xgen,"Если предполагается, что прочие условие равны, то расположил бы в указанном порядке предпочтения. Сочетание факторов: Language, Closed bug reports, Stars, Release date, Contributors. Дальше скорее опосредованное влияние, непрямое: Lines of code, last commit, pull requests. Forks кажется не повлиял бы никак на мой выбор.","Укажите его приоритет и степень серьезности, Прочитать руководство пользователя, возможно, что-то делаете не так",,Фрилансер,БОльшой ),"Навскидку, 3-5. Но не все репортю, потому что бывают известные баги",
12/6/2023 21:25:43,SWXMLHash,quick-xml,xgen,libexpat,Fuzi,"Stars and forks in proportion to release date (days ago), medium closed bug reports/pull requests/issues (too many means lot of bugs, too few may mean they don't solve it), ","Get rid of the redundant 3--minute video, Read user manual, maybe you do something wrong",,,,,
12/6/2023 21:52:06,SWXMLHash,Fuzi,quick-xml,libexpat,xgen,По звездочкам,"Better explain how to reproduce it, Specify its priority and severity, Get rid of the redundant 3--minute video",,,,,
12/6/2023 23:40:39,Fuzi,SWXMLHash,libexpat,quick-xml,xgen,"1- closed bug reports, then 2- number of stars, then 3- primary language, then 4- release-date, then, there is one option else only","Instead, post to project chat, for a faster fix, Get rid of the redundant 3--minute video",,Innopolis University,"R&D in AI, Matlab essentially and sometimes Python",0,
12/7/2023 1:09:55,libexpat,quick-xml,Fuzi,SWXMLHash,xgen,"Stars, forks, lines of code, closed pull requests, contributors","Specify its priority and severity, Read user manual, maybe you do something wrong, Better explain how to reproduce it",,,,,
12/7/2023 3:15:58,Fuzi,SWXMLHash,xgen,quick-xml,libexpat,"For 3: 
- It has 3 years experience.
- It has not much code
For 4:
- A lot of stars
- A lot of contributors
For 5:
- Quite many lines of code
- A lot of issues

But to be honest I don't think that my answers are helpful. Sorry if answer is awful.","Better explain how to reproduce it, Read user manual, maybe you do something wrong",,"Android Developer, @Koodrick",1.5 years,0,
12/7/2023 7:12:58,Fuzi,SWXMLHash,xgen,quick-xml,libexpat,"Fuzi - это библиотека разбора XML для языка программирования Swift. Fuzi обладает простым и интуитивно понятным API, обеспечивает высокую производительность и надежность. Она имеет хорошую поддержку, активно развивается и обновляется. (Closed bug reports, Stars, Release date (days ago))","Вместо этого отправить сообщение в чат проекта, чтобы быстрее решить проблему, Избавиться от лишнего 3-минутного видеоролика",,,,,
12/7/2023 8:25:59,SWXMLHash,Fuzi,xgen,quick-xml,libexpat,"Количество кода, сколько форков, коммиты, закрытых ишью","Укажите его приоритет и степень серьезности, Избавиться от лишнего 3-минутного видеоролика",,,,,
12/7/2023 10:24:56,xgen,libexpat,quick-xml,Fuzi,SWXMLHash,"Stars, closed issues and closed bugs",Specify its priority and severity,,,,,
12/7/2023 10:26:54,xgen,libexpat,quick-xml,Fuzi,SWXMLHash,Stars,"Don't report, since it's a primitive bug",,Program manger,+8 years,Many bugs,
12/7/2023 11:51:21,libexpat,SWXMLHash,Fuzi,quick-xml,xgen,"Programming languages, closed bug report, line of code","Better explain how to reproduce it, Don't report, since it's a primitive bug",,,"Robotics , embedded C",None,
12/7/2023 12:02:52,quick-xml,SWXMLHash,Fuzi,libexpat,xgen,"quick-xml is the first preference because it appears actively developed (based on many metrics, but mostly on the last commit date). SWXMLHash and Fuzi are quite similar, they are less actively developed but still used, judging by the number of stars. What I disliked about libexpat is that it is a huge library (TWO orders of magnitude larger than xgen, SWXMLHash and Fuzi!) and is in an unsafe language: these two in combination are not attractive. xgen is least preferable because there are few contributors, few stars, few issues, which indicates there isn't a lot of attention towards the library from other developers.","Better explain how to reproduce it, Get rid of the redundant 3--minute video",,None,Below 1 year,10±2,
12/7/2023 13:22:54,SWXMLHash,libexpat,Fuzi,quick-xml,xgen,"Stars, Release date, Closed bug reports","Specify its priority and severity, Read user manual, maybe you do something wrong, Better explain how to reproduce it",,,,,
12/7/2023 13:33:54,quick-xml,libexpat,SWXMLHash,Fuzi,xgen,"Stars, contributors, last commit, closed issues(focus on maintenance)","Instead, post to project chat, for a faster fix, Read user manual, maybe you do something wrong",,,,,
12/7/2023 20:39:28,quick-xml,SWXMLHash,Fuzi,xgen,libexpat,"The most important metrics for me are stars, closed issues, contributors","Instead, post to project chat, for a faster fix, Specify its priority and severity, Read user manual, maybe you do something wrong",,,,,
12/7/2023 20:53:07,SWXMLHash,quick-xml,Fuzi,xgen,libexpat,closed bug reports/forks/lines of code/stars,"Specify its priority and severity, Better explain how to reproduce it",,Intern,4 days,none 😭,
12/7/2023 21:36:31,libexpat,quick-xml,SWXMLHash,Fuzi,xgen,"1. the amount of stars - it basically describes how adopted the technology is.
2. number of lines of code - it reflects how much the product is tested and how many edge cases are covered.
3. release date/last commit date - any product can be improved infinitely more, so the more recent commit it has, the more healthy it is.
4. the language - it is a vague thing to rely on it, but some languages are subjectively more preferable by me than anothers","Read user manual, maybe you do something wrong, Specify its priority and severity, Better explain how to reproduce it, Get rid of the redundant 3--minute video, Instead, post to project chat, for a faster fix",,"fullstack (im the only one developer, idk is it lead position?)",startups and a olympiad task development,single one on a open source project i've used,
12/7/2023 21:48:35,SWXMLHash,quick-xml,Fuzi,libexpat,xgen,"Stars, Primary language","Better explain how to reproduce it, Read user manual, maybe you do something wrong",,none,none,0,
12/7/2023 22:21:37,libexpat,xgen,quick-xml,Fuzi,SWXMLHash,"Programming language, last commit, stars - I choose the ones subjectively based on the personal experience.","Read user manual, maybe you do something wrong",,,,,
12/7/2023 22:33:07,quick-xml,Fuzi,SWXMLHash,xgen,libexpat,"Mostly I focused on last commit, then stars, then release date, then forks and finally size of library (number of lines) ","Better explain how to reproduce it, Specify its priority and severity",,Middle backend developer,2 years,"I'm fixing the bugs, not reporting them",
12/7/2023 22:48:03,quick-xml,libexpat,SWXMLHash,Fuzi,xgen,"There is an active maintaining of my preferred libraries (e.g closed requests, reported bugs, last commits)","Read user manual, maybe you do something wrong, Specify its priority and severity",,,,,
12/7/2023 22:56:48,libexpat,quick-xml,Fuzi,SWXMLHash,xgen,"Language, Lines of code, Last commit","Не сообщайть, так как это примитивная ошибка., Прочитать руководство пользователя, возможно, что-то делаете не так",,,,,
12/7/2023 23:13:28,xgen,SWXMLHash,quick-xml,Fuzi,libexpat,У них более лучшие параметры,"Укажите его приоритет и степень серьезности, Прочитать руководство пользователя, возможно, что-то делаете не так",,,,,
12/8/2023 0:03:11,quick-xml,libexpat,Fuzi,xgen,SWXMLHash,"Maybe on release day(top 1), Primary language(top 2, more low level) and and Contributors(top 3)","Specify its priority and severity, Better explain how to reproduce it, Read user manual, maybe you do something wrong",,,,,
12/8/2023 0:52:58,quick-xml,libexpat,SWXMLHash,Fuzi,xgen,"I mostly based on the following metrics: Release Date, Last Commit, Forks, Contributors, Closed Issues","Read user manual, maybe you do something wrong, Specify its priority and severity",,,,,
12/8/2023 3:58:10,quick-xml,libexpat,SWXMLHash,Fuzi,xgen,"My preferences are based on the level of maintenance, how regular issues closes, the level of appreciation of the software based on stars. It also could be better to show the correlation between opened/closed issues at the repo. As a suggestion I would also refer to the documentation to validate how accurate and relevant it is. ","Read user manual, maybe you do something wrong, Specify its priority and severity",,Fullstack developer,3 years. ,40+,
12/8/2023 5:13:49,quick-xml,libexpat,Fuzi,SWXMLHash,xgen,"last commit , lines of codes, Stars,","Instead, post to project chat, for a faster fix, Get rid of the redundant 3--minute video, Specify its priority and severity",,Frontend Developer,1.5 year,,
12/8/2023 10:20:41,quick-xml,SWXMLHash,Fuzi,xgen,libexpat,"The library should be small ( not 100500+ lines of code), Rust is a robust language, so it's better. More stars and forks means the library is used more often - also a plus. Moreover it is better if the library is updated not for too long. Higher number of closed issues - the developers care about the product.","Instead, post to project chat, for a faster fix, Read user manual, maybe you do something wrong, Specify its priority and severity",,Lab worker ,1.5 years,0,
12/8/2023 11:22:05,quick-xml,libexpat,SWXMLHash,Fuzi,xgen,"programming language, forks, contributors, closed issues",Specify its priority and severity,,,,,
12/8/2023 11:47:40,quick-xml,libexpat,SWXMLHash,Fuzi,xgen,"Старсы, языки","Read user manual, maybe you do something wrong, Get rid of the redundant 3--minute video",,0,0,0,
12/8/2023 19:45:50,libexpat,quick-xml,SWXMLHash,xgen,Fuzi,"звезды, коммиты, закрытые проблемы, участники","Лучше объяснить, как баг воспроизвести, Прочитать руководство пользователя, возможно, что-то делаете не так",,,,,
12/8/2023 20:05:06,SWXMLHash,xgen,quick-xml,Fuzi,libexpat,"Они предоставляют разработчикам возможность парсинга и обработки XML-данных, что может быть полезно при создании приложений для работы с книгами и другими текстовыми данными.","Укажите его приоритет и степень серьезности, Избавиться от лишнего 3-минутного видеоролика",,Инженер отдела эксплуатации,имею,не репортил,
12/8/2023 21:19:27,xgen,libexpat,Fuzi,SWXMLHash,quick-xml,"Я основывался на метриках closed bug reports, forks и closed issues","Укажите его приоритет и степень серьезности, Избавиться от лишнего 3-минутного видеоролика",,,,52,
12/8/2023 23:17:37,libexpat,quick-xml,Fuzi,SWXMLHash,xgen,"Obviously I look on all metrics, especially number of forks (the more forks, the more community appreciate this lib as a high quality product that is good enough to be forked for your own project), last commit (if the lib is still maintained, then it is valuable and has some demand), closed bug reports/issues (the more of them, the more this lib is tested and verified)","Specify its priority and severity, Get rid of the redundant 3--minute video",,,,,
12/9/2023 9:33:51,SWXMLHash,Fuzi,xgen,quick-xml,libexpat,"My chose is SWXMLHash - 
> It has the second highest number of stars at 1345. More stars generally indicates broader usage and support within the development community.
> It has a relatively high number of contributors at 38. More contributors means more people reviewing and improving the codebase.
> It uses Swift as its primary programming language. For an iOS software architect like myself, using a library written in the native Swift language could provide better integration and performance.
> It has the third lowest number of closed issues at 140. Fewer closed issues signals higher quality and fewer bugs.
> It has an average number of closed pull requests at 114. This shows active development and maintenance of the library.
> The last commit was relatively recently at 179 days ago. This indicates it is still being actively updated.","Better explain how to reproduce it, Specify its priority and severity",,CTO,7y,<10,
12/10/2023 10:33:12,SWXMLHash,quick-xml,Fuzi,libexpat,xgen,"Stars, Last commit, release date, LOC","Read user manual, maybe you do something wrong, Instead, post to project chat, for a faster fix, Don't report, since it's a primitive bug",,,,,
12/10/2023 11:04:38,quick-xml,libexpat,SWXMLHash,Fuzi,xgen,I try to estimate integral activity developers of library. Something like count of commits for last half-year.,"Specify its priority and severity, Read user manual, maybe you do something wrong, Instead, post to project chat, for a faster fix",,Data Analyst,7 years,5,
